Titulo,ResumenEs,ResumenEn,Fecha,Link,Image
Así responden la agricultura y la ganadería al desafío del cambio climático,"Se destacan los esfuerzos de Colombia para hacer frente al cambio climático en la agricultura y la ganadería. Se mencionan los programas gubernamentales y las asociaciones público-privadas, así como iniciativas específicas de asociaciones agrícolas. La investigación y el desarrollo de tecnologías innovadoras se destacan como claves para la adaptación al cambio climático. Además, se destacan los beneficios socioeconómicos y medioambientales de las prácticas sostenibles. Se subraya la importancia de la colaboración entre los diferentes actores y se destaca la necesidad de seguir trabajando para fortalecer la resiliencia del país al cambio climático.","Colombia's efforts to address climate change in agriculture and livestock farming are highlighted. Mention is made of government programs and public-private partnerships, as well as specific initiatives of agricultural associations. Research and development of innovative technologies are highlighted as key to climate change adaptation. In addition, the socioeconomic and environmental benefits of sustainable practices are highlighted. The importance of collaboration between different actors is emphasized and the need to continue working to strengthen the country's resilience to climate change is highlighted.",30/3/2024,https://www.semana.com/mejor-colombia/articulo/asi-responden-la-agricultura-y-la-ganaderia-al-desafio-del-cambio-climatico/202410/,https://www.semana.com/resizer/S7jfU2uGvoapkvF6NmN4BFP9p6s=/1280x720/smart/filters:format(jpg):quality(80)/cloudfront-us-east-1.images.arcpublishing.com/semana/SPVHPG3QXJCC5ESGFJE7CXKZYI.jpg
"AClimate Colombia, nueva luz para los agricultores colombianos","El CIAT capacitó a equipos de agroclimatología de la Federación Nacional de Arroceros y la Federación Nacional de Productores de Cereales y Leguminosas en el uso de la plataforma 'Aclimate Colombia Forecasts'. La plataforma es parte del proyecto 'Servicios Climáticos para el Desarrollo Resiliente-Colombia' financiado por USAID y proporciona información climática precisa y oportuna a las asociaciones agrícolas para ayudarlos a tomar mejores decisiones de siembra y prepararse para las variaciones climáticas. La plataforma permite conocer las condiciones climáticas futuras a partir de información histórica y se relaciona con modelos de simulación de cultivos para brindar información más relevante a los productores. El CIAT trabajará de cerca con las organizaciones de productores para abordar sus prioridades.","CIAT trained agro-climatology teams from the National Federation of Rice Growers and the National Federation of Cereal and Legume Growers in the use of the 'Aclimate Colombia Forecasts' platform. The platform is part of the USAID-funded 'Climate Services for Resilient Development-Colombia' project and provides accurate and timely climate information to agricultural associations to help them make better planting decisions and prepare for climatic variations. The platform allows knowing future weather conditions based on historical information and is related to crop simulation models to provide more relevant information to producers. CIAT will work closely with producer organizations to address their priorities.",16/8/2017,https://alliancebioversityciat.org/stories/aclimate-colombia-nueva-luz-para-los-agricultores-colombianos,"https://alliancebioversityciat.org/sites/default/files/styles/1920_scale/public/images/modelacion.jpg?itok=3oTjTus8"
"AClimate Colombia, a new light for Colombian farmers","El CIAT (Centro Internacional de Agricultura Tropical) capacitó a los equipos de agroclimatología y sistemas de la Federación Nacional de Cultivadores de Arroz (Fedearroz) y la Federación Nacional de Cultivadores de Cereales y Leguminosas (Fenalce) en el uso de la plataforma 'Pronósticos Aclimata Colombia' . Esta plataforma es parte del proyecto 'Servicios Climáticos para el Desarrollo Resiliente - Colombia' financiado por USAID, cuyo objetivo es mejorar los métodos y herramientas de pronóstico para que los agricultores tomen mejores decisiones sobre la siembra de cultivos. La plataforma proporciona información climática fiable a las asociaciones y permite el acceso a información agroclimática, facilitando el análisis e interpretación de datos meteorológicos y la configuración de modelos de previsión climática. También ayuda a predecir las condiciones futuras de temperatura y lluvia y conecta las predicciones climáticas con modelos de simulación de cultivos, proporcionando información más contextualizada a los agricultores. El papel del CIAT es trabajar de cerca con las organizaciones de productores para comprender sus prioridades y brindar la información necesaria. La plataforma tiene como objetivo que el sector agrícola colombiano esté mejor preparado para enfrentar las variaciones climáticas.","CIAT (International Center for Tropical Agriculture) trained the teams of agro-climatology and systems from the National Federation of Rice Growers (Fedearroz) and the National Federation of Cereal and Legume Growers (Fenalce) in the use of the platform 'Pronósticos Aclimate Colombia'. This platform is part of the 'Climate Services for Resilient Development - Colombia' project funded by USAID, aimed at improving forecasting methods and tools for farmers to make better decisions about planting crops. The platform provides reliable climate information to the associations and enables access to agro-climate information, making it easier to analyze and interpret meteorological data and configure climate forecasting models. It also helps predict future temperature and rainfall conditions and connect climate predictions with crop simulation models, providing more contextualized information to farmers. CIAT's role is to work closely with producer organizations to understand their priorities and provide the necessary information. The platform aims to make the Colombian agricultural sector better prepared to confront climate variations.",22/8/2017,"https://alliancebioversityciat.org/stories/aclimate-colombia-acclimatize-colombia-new-light-colombian-farmers","https://alliancebioversityciat.org/sites/default/files/styles/1920_scale/public/images/modelacion.jpg?itok=3oTjTus8"
"Melisa chatbot, el 'oráculo' de los agricultores colombianos","La Alianza Bioversity International y el CIAT lanzaron 'Melisa chatbot', un sistema de inteligencia artificial que brinda pronósticos agroclimáticos disponibles en Whatsapp, Facebook y Telegram. La plataforma de pronósticos, denominada 'Aclimata Colombia', es accesible a través del chatbot Melisa y permite a los agricultores y campesinos consultar los pronósticos sobre las precipitaciones y el rendimiento potencial de los cultivos de arroz y maíz de acuerdo a las condiciones climáticas y la fecha en que fueron sembrados. la variedad de semilla utilizada, entre otros factores. La plataforma funciona como cualquier otro contacto en las redes sociales y es posible hacer preguntas en el chat y obtener respuestas sobre las previsiones meteorológicas y el rendimiento de los cultivos. Actualmente, los departamentos disponibles para consulta son Casanare, Córdoba, Tolima, Valle del Cauca y Huila.","The Bioversity International Alliance and CIAT have launched 'Melisa chatbot', an artificial intelligence system that provides agro-climatic forecasts available on Whatsapp, Facebook and Telegram. The forecast platform, called 'Aclimate Colombia', is accessible through the Melisa chatbot and allows farmers and peasants to consult forecasts on rainfall and the potential yield of rice and corn crops according to weather conditions and the date on which they were sow the crop, the variety of seed used, among other factors. The platform works like any other contact on social networks and it is possible to ask questions in the chat and get answers about weather forecasts and crop yields. Currently, the departments available for consultation include Casanare, Córdoba, Tolima, Valle del Cauca, and Huila.",5/8/2022,"https://www.agronet.gov.co/Noticias/Paginas/Melisa-chatbot,-el-%E2%80%98or%C3%A1culo%E2%80%99-de-los-agricultores-colombianos.aspx","https://www.agronet.gov.co/Noticias/PublishingImages/Melisa%20infografia-01%20(1).jpg"
"Melisa chatbot","Melisa chatbot es un sistema de IA disponible en WhatsApp, Facebook y Telegram que brinda pronósticos agroclimáticos y de rendimiento para cultivos de arroz y maíz en Colombia. Utiliza pronósticos climáticos del servicio Aclimate Colombia y se comunica con los usuarios en un lenguaje no técnico para apoyar su toma de decisiones. Actualmente está disponible en 9 departamentos y se puede acceder agregando a Melisa como contacto en WhatsApp, Facebook Messenger o Telegram. La herramienta es útil para los agricultores y las comunidades rurales que necesitan comprender los pronósticos meteorológicos y climáticos y cómo afectan la producción de sus cultivos. El objetivo es eventualmente hacerlo accesible en otras plataformas como SMS para áreas de Internet de baja calidad. Los resultados se actualizarán a medida que surjan.","Melisa chatbot is an AI system available on WhatsApp, Facebook and Telegram that provides agroclimatic and yield forecasts for rice and maize crops in Colombia. It uses climate forecasts from the Aclimate Colombia service and communicates with users in non-technical language to support their decision making. It is currently available in 9 departments and can be accessed by adding Melisa as a contact on WhatsApp, Facebook Messenger or Telegram. The tool is useful for farmers and rural communities who need to understand weather and climate forecasts and how they impact their crop production. The aim is to eventually make it accessible on other platforms like SMS for low quality internet areas. Results will be updated as they emerge.",5/8/2022,https://alliancebioversityciat.org/tools-innovations/melisa-chatbot,"https://alliancebioversityciat.org/sites/default/files/styles/1920_scale/public/images/Melisa%20chatbot.png?itok=pY1ly2ag"
Melisa chatbot - the 'oracle' for Colombian farmers,"Melisa Chatbot es un sistema de inteligencia artificial que brinda pronósticos agroclimáticos, desarrollado por la Alianza de Bioversity International y el Centro Internacional de Agricultura Tropical (CIAT). Es accesible a través de WhatsApp, Facebook y Telegram y brinda información sobre pronósticos del tiempo, rendimientos de cultivos de arroz y maíz según fechas de siembra y variedad de semillas. La plataforma utiliza el servicio Aclimate Colombia y es capaz de interpretar las necesidades de información de los usuarios y brindar respuestas precisas. Actualmente, el servicio está disponible en varios departamentos de Colombia y el plan es que esté disponible en áreas con poca cobertura de internet en el futuro. El proyecto cuenta con el apoyo de varios socios y está liderado por el científico Julián Ramírez.","Melisa Chatbot is an artificial intelligence system that provides agro-climatic forecasts, developed by the Alliance of Bioversity International and the International Center for Tropical Agriculture (CIAT). It is accessible through WhatsApp, Facebook and Telegram and provides information on weather forecasts, rice and corn crop yields based on sowing dates and seed variety. The platform uses the Aclimate Colombia service and is able to interpret user's information needs and provide accurate answers. The service is currently available in several Colombian departments and the plan is to make it available in areas with poor internet coverage in the future. The project is supported by several partners and is led by scientist Julián Ramírez.",22/7/2022,https://alliancebioversityciat.org/stories/melisa-chatbot-el-oraculo-de-los-agricultores-colombianos,"https://alliancebioversityciat.org/sites/default/files/styles/1920_scale/public/images/Melisa%20chatbot.png?itok=pY1ly2ag"
"Digital for Climate Adaptation and Resilience of Vulnerable Communities","La organización NetHope ha lanzado la Iniciativa de Intersecciones Climáticas con el objetivo de aprovechar las tecnologías digitales para mitigar los efectos del cambio climático en las poblaciones vulnerables. Esta iniciativa se enfoca en promover la adaptación climática y la resiliencia en comunidades de todo el mundo. La organización tiene la intención de utilizar análisis de paisaje para identificar nuevas oportunidades para la acción colectiva en este espacio. La primera entrega de este programa proporciona ejemplos de cómo los miembros de NetHope, en colaboración con las comunidades afectadas y otras partes interesadas, utilizan tecnologías digitales para apoyar la adaptación y la resiliencia climáticas, así como para identificar áreas de mejora. La organización planea expandir y actualizar el estudio a medida que aprenden más sobre el trabajo de las ONG y los socios en este espacio, con el objetivo de formular recomendaciones para la acción colectiva en beneficio de las comunidades vulnerables en todo el mundo.","The NetHope organization has launched the Climate Intersections Initiative with the goal of leveraging digital technologies to mitigate the effects of climate change on vulnerable populations. This initiative focuses on promoting climate adaptation and resilience in communities across the globe. The organization intends to use landscape analyses to identify new opportunities for collective action in this space. The first installment of this program provides examples of how NetHope Members, in collaboration with affected communities and other stakeholders, use digital technologies to support climate adaptation and resilience, as well as identifying areas for improvement. The organization plans to expand and update the study as they learn more about the work of NGOs and partners in this space, with the goal of formulating recommendations for collective action to benefit vulnerable communities worldwide.",1/10/2022,"https://nethope.org/wp-content/uploads/2022/10/NetHope_Digital-for-Climate-Adaptation-and-Resilience_First-Installment_October-2022.pdf","https://nethope.org/wp-content/uploads/2022/10/DCAR_Collage-1-1-1024x569.png"
"Fortaleciendo el Sector Agrícola en San Martín, Perú a partir de nuevos Servicios Agroclimáticos","El departamento de San Martín en Perú enfrenta desafíos en la agricultura debido a los cambios climáticos. El proyecto Peru-Hub, liderado por la Universidad Nacional Agraria La Molina (UNALM), busca desarrollar tecnologías avanzadas para una agricultura sostenible y resiliente. Se identificaron riesgos como sequías, plagas, inundaciones y bajas temperaturas. El proyecto busca proporcionar información agroclimática precisa a los agricultores, incluyendo pronósticos climáticos, mapas de riesgos y proyecciones de cultivos. Se está adaptando la plataforma AClimate para cumplir con estas necesidades y se espera obtener mejores resultados en la planificación de actividades agrícolas, reducción de pérdidas económicas y desarrollo de habilidades tecnológicas.","The department of San Martin in Peru faces challenges in agriculture due to climate change. The Peru-Hub project, led by the Universidad Nacional Agraria La Molina (UNALM), aims to develop advanced technologies for sustainable and resilient agriculture. Risks such as droughts, pests, floods and low temperatures were identified. The project aims to provide accurate agro-climatic information to farmers, including climate forecasts, risk maps and crop projections. The AClimate platform is being adapted to meet these needs and is expected to provide better results in planning agricultural activities, reducing economic losses and developing technological skills.","26/6/2023","https://alliancebioversityciat.org/es/stories/fortaleciendo-el-sector-agricola-en-san-martin-peru-partir-de-nuevos-servicios","https://alliancebioversityciat.org/sites/default/files/styles/1920_scale/public/images/sanmartinperu_0.jpg?itok=Iycghhbz"
"Release of a new AClimate R API package","Hoy, nos complace anunciar el lanzamiento de un nuevo hito en la accesibilidad y potencia analítica para los entusiastas, científicos y profesionaless: el paquete AClimate R API. Este innovador recurso abre las puertas a información climática y agroclimática, permitiendo a la comunidad R sumergirse en los datos de AClimate con facilidad y eficiencia.","Today, we are pleased to announce the launch of a new milestone in accessibility and analytical power for enthusiasts, scientists and professionals: the AClimate R API package. This innovative resource opens the doors to climate and agroclimatic information, allowing the R community to dive into AClimate data with ease and efficiency.","17/11/2023","https://github.com/CIAT-DAPA/aclimaterapi","https://raw.githubusercontent.com/CIAT-DAPA/aclimate_site/main/assets/R%2BAClimate.jpg"
"¡AClimate está de Aniversario! X","10 años fortaleciendo la toma de decisiones de diversos públicos relacionados con la agricultura y la seguridad alimentaria en América Latina y África.💻🌱","10 years strengthening the decision making of diverse audiences related to agriculture and food security in Latin America and Africa.💻🌱","11/3/2024","https://twitter.com/BiovIntCIAT_esp/status/1767248992042172642","https://www.aclimate.org/static/media/Logo.4e27fd7d9947997ac1a2.png"
"¡AClimate está de Aniversario! Facebook","10 años fortaleciendo la toma de decisiones de diversos públicos relacionados con la agricultura y la seguridad alimentaria en América Latina y África.💻🌱","10 years strengthening the decision making of diverse audiences related to agriculture and food security in Latin America and Africa.💻🌱","11/3/2024","https://www.facebook.com/reel/1149901142670966","https://www.aclimate.org/static/media/Logo.4e27fd7d9947997ac1a2.png"
"¡AClimate está de Aniversario! Linkedin","10 años fortaleciendo la toma de decisiones de diversos públicos relacionados con la agricultura y la seguridad alimentaria en América Latina y África.💻🌱","10 years strengthening the decision making of diverse audiences related to agriculture and food security in Latin America and Africa.💻🌱","11/3/2024","https://www.linkedin.com/posts/ciat_aclimate10aaehos-activity-7173027565375336449-aR6k","https://www.aclimate.org/static/media/Logo.4e27fd7d9947997ac1a2.png"
"📢Hoy en InnovaciónenAcción el turno es para el especial de AClimate10años 🌎","Hoy evocamos los orígenes de la plataforma y aquellas lecciones aprendidas durante los 10 años de este gran aporte desde Acción Climática ALC, para el fortalecimiento en la toma de decisiones. 🌱👩🌾","Today we evoke the origins of the platform and those lessons learned during the 10 years of this great contribution from Acción Climática ALC, for the strengthening in decision making. 🌱👩🌾","14/3/2024","https://www.linkedin.com/posts/ciat_innovaciaejnenacciaejn-aclimate10aaehos-ugcPost-7174076643622178817-xecZ?utm_source=share&utm_medium=member_desktop","https://raw.githubusercontent.com/CIAT-DAPA/aclimate_site/main/assets/VideoSS.png"
"📢¡Aniversario AClimate! #AClimate10años","Hoy te contamos 4 datos interesantes sobre nuestra plataforma. 💻🌱 Descubre qué es, cuáles son los 8 países donde tenemos presencia, cuál es su público objetivo y cuáles son aquellos atributos que nos destacan.","Today we tell you 4 interesting facts about our platform. 💻🌱Discover what it is, what are the 8 countries where we are present, what is its target audience and what are those attributes that make us stand out.","12/3/2024","https://twitter.com/BiovIntCIAT_esp/status/1767619409533678051","https://pbs.twimg.com/media/GIfYaVAXcAAQXsN?format=jpg&name=medium"
"📢#AClimate10años ¿#SabíasQue la plataforma AClimate cada vez expande más el alcance de sus pronósticos estacionales?💻🌱","Continuamos trabajando para generar información agroclimática actualizada y certera en diferentes partes del mundo🌎⬇️","We continue working to generate updated and accurate agroclimatic information in different parts of the world🌎⬇️","13/3/2024","https://twitter.com/BiovIntCIAT_esp/status/1768003125929988224","https://pbs.twimg.com/media/GIk1dOLWUAE1uPj?format=jpg&name=medium"
"📢#AClimate10años ¡De Colombia para el mundo! 🌎La Plataforma AClimate ya llegó a Angola.","Así estamos contribuyendo a la planificación estratégica del Min. de Agricultura, entidades Financieras, Secretaría de Gestión de Riesgo y más","In this way we are contributing to the strategic planning of the Ministry of Agriculture, financial entities, Risk Management Secretariat and more.","15/3/2024","https://twitter.com/BiovIntCIAT_esp/status/1768732578658259351","https://raw.githubusercontent.com/CIAT-DAPA/aclimate_site/main/assets/VideoSS2.png"
"Release of a new AClimate Python API package","Hoy, nos complace anunciar el lanzamiento de un nuevo hito en la accesibilidad y potencia analítica para los entusiastas, científicos y profesionaless: el paquete AClimate Python API. Este innovador recurso abre las puertas a información climática y agroclimática, permitiendo a la comunidad de Python sumergirse en los datos de AClimate con facilidad y eficiencia.","Today, we are pleased to announce the launch of a new milestone in accessibility and analytical power for enthusiasts, scientists and professionals: the AClimate Python API package. This innovative resource opens the doors to climate and agroclimatic information, allowing the Python community to dive into AClimate data with ease and efficiency.","31/5/2024","https://github.com/CIAT-DAPA/aclimatepyapi","https://raw.githubusercontent.com/CIAT-DAPA/aclimate_site/main/assets/PythonPlusAclimate.jpg"
"Curso-taller: Plataforma Aclimate y modelamiento de cultivos tropicales","Ponente Camilo Barrios, especialista de investigación en @bioversityciat, presente en el curso-taller: Plataforma Aclimate y Modelamiento de Cultivos Tropicales que se llevó a cabo en el auditorio de la @drasamsanmartin","Speaker Camilo Barrios, research specialist at @bioversityciat, present at the course-workshop: Aclimate Platform and Modeling of Tropical Crops that took place in the auditorium of the @drasamsanmartin.","20/6/2024","https://www.youtube.com/shorts/7gmkaHAQI4c","https://raw.githubusercontent.com/CIAT-DAPA/aclimate_site/main/assets/taller.png"
"Boletines informativos de melisa chatbot para captura de datos y pruebas en campo en Honduras","Este documento presenta los boletines informativos diseñados para explicar el uso de Melisa chatbot, una herramienta adaptada para Honduras con el fin de capturar datos meteorológicos. Se desarrollaron tres boletines específicos para diferentes tipos de estaciones: 1) estaciones meteorológicas convencionales; 2) estaciones termo-pluviométricas; 3) estaciones pluviométricas destinadas al Centro Nacional de Estudios Atmosféricos, Oceanográficos y Sísmicos (CENAOS) y la Dirección General de Recursos Hídricos (DGRH) de Honduras, y 4) pluviómetros para el Sistema de Alerta Temprana (SAT) del Municipio del Distrito Central (AMDC). Además, se documentan pruebas en campo realizadas con observadores de estaciones climatológicas utilizando el chatbot para la recolección de datos meteorológicos. Los resultados de las pruebas demostraron la eficacia y facilidad de uso del chatbot, facilitando la recolección de datos y mejorando la rapidez en la transmisión de la información hacia el sistema central de CENAOS, validando así su utilidad como herramienta de apoyo en la operativa diaria de los observadores.","This document presents the newsletters designed to explain the use of Melisa chatbot, a tool adapted for Honduras to capture meteorological data. Three specific newsletters were developed for different types of stations: 1) conventional weather stations; 2) thermo-pluviometric stations; 3) pluviometric stations for the National Center for Atmospheric, Oceanographic and Seismic Studies (CENAOS) and the General Directorate of Water Resources (DGRH) of Honduras, and 4) pluviometers for the Early Warning System (SAT) of the Central District Municipality (AMDC). In addition, field tests conducted with weather station observers using the chatbot for weather data collection are documented. The results of the tests demonstrated the effectiveness and ease of use of the chatbot, facilitating data collection and improving the speed of information transmission to the CENAOS central system, thus validating its usefulness as a support tool in the daily operations of the observers.","13/9/2024","https://hdl.handle.net/10568/152313","https://cgspace.cgiar.org/server/api/core/bitstreams/c9b36cec-aa78-430e-a189-6d8cd46ff26d/content"
